{
  "$schema": "https://status.dig.net/status.schema.json",
  "schemaVersion": 1,
  "generatedAt": "2026-10-20T02:58:10.095Z",
  "overall": "down",
  "summary": {
    "up": 8,
    "degraded": 1,
    "down": 3,
    "total": 12
  },
  "systems": [
    {
      "id": "rpc",
      "name": "rpc.dig.net",
      "category": "Read path",
      "status": "up",
      "latencyMs": 538,
      "checkedAt": "2026-10-20T02:58:09.931Z",
      "description": "DIG JSON-RPC read service (blind content retrieval).",
      "url": "https://rpc.dig.net/",
      "detail": {
        "kind": "jsonrpc",
        "method": "dig.methods"
      }
    },
    {
      "id": "hub-api",
      "name": "hub.dig.net /v1",
      "category": "Control plane",
      "status": "down",
      "latencyMs": 198,
      "checkedAt": "2026-10-20T02:58:09.612Z",
      "description": "DIGHUb REST /v1 control plane (account/store/domain lifecycle).",
      "url": "https://hub.dig.net/v1/health",
      "detail": {
        "kind": "http",
        "httpStatus": 500,
        "errorCode": "HTTP_5XX"
      }
    },
    {
      "id": "docs",
      "name": "docs.dig.net",
      "category": "Sites",
      "status": "up",
      "latencyMs": 137,
      "checkedAt": "2026-10-20T02:58:09.587Z",
      "description": "Docusaurus documentation site (HTTP 200 + cert).",
      "url": "https://docs.dig.net/",
      "detail": {
        "kind": "http",
        "httpStatus": 200
      }
    },
    {
      "id": "explore",
      "name": "explore.dig.net",
      "category": "Sites",
      "status": "up",
      "latencyMs": 271,
      "checkedAt": "2026-10-20T02:58:09.718Z",
      "description": "Curated DIG Network dApp store (HTTP 200 + cert).",
      "url": "https://explore.dig.net/",
      "detail": {
        "kind": "http",
        "httpStatus": 200
      }
    },
    {
      "id": "dignet",
      "name": "dig.net",
      "category": "Sites",
      "status": "up",
      "latencyMs": 207,
      "checkedAt": "2026-10-20T02:58:09.659Z",
      "description": "Marketing site (HTTP 200 + cert).",
      "url": "https://dig.net/",
      "detail": {
        "kind": "http",
        "httpStatus": 200
      }
    },
    {
      "id": "cdn",
      "name": "cdn.dig.net",
      "category": "Read path",
      "status": "degraded",
      "latencyMs": 197,
      "checkedAt": "2026-10-20T02:58:09.648Z",
      "description": "§21 encrypted-chunk CDN (host front).",
      "url": "https://cdn.dig.net/",
      "detail": {
        "kind": "http",
        "httpStatus": null,
        "errorCode": "TRANSPORT"
      },
      "error": "fetch failed",
      "excludeFromOverall": true
    },
    {
      "id": "apt",
      "name": "apt.dig.net",
      "category": "Distribution",
      "status": "up",
      "latencyMs": 254,
      "checkedAt": "2026-10-20T02:58:09.706Z",
      "description": "Ubuntu/Debian APT repository (apt install the DIG ecosystem).",
      "url": "https://apt.dig.net/",
      "detail": {
        "kind": "http",
        "httpStatus": 200
      },
      "excludeFromOverall": true
    },
    {
      "id": "on-resolver",
      "name": "*.on.dig.net",
      "category": "Read path",
      "status": "down",
      "latencyMs": 369,
      "checkedAt": "2026-10-20T02:58:09.820Z",
      "description": "Subdomain resolver — serves published store content per subdomain (branded loader + client-side decrypt).",
      "url": "https://chia-offer.on.dig.net/",
      "detail": {
        "kind": "http",
        "httpStatus": 500,
        "errorCode": "HTTP_5XX"
      }
    },
    {
      "id": "bugreport-api",
      "name": "api.bugreport.dig.net",
      "category": "Control plane",
      "status": "down",
      "latencyMs": 403,
      "checkedAt": "2026-10-20T02:58:09.855Z",
      "description": "Bug-report intake API (auto-report → S3 + GitHub issues) every DIG frontend embeds.",
      "url": "https://api.bugreport.dig.net/v1/health",
      "detail": {
        "kind": "http",
        "httpStatus": 500,
        "errorCode": "HTTP_5XX"
      }
    },
    {
      "id": "relay",
      "name": "relay.dig.net",
      "category": "Network",
      "status": "up",
      "latencyMs": 354,
      "checkedAt": "2026-10-20T02:58:09.808Z",
      "description": "NAT-traversal relay (rendezvous + circuit relay) DIG nodes connect through.",
      "url": "wss://relay.dig.net:443",
      "detail": {
        "kind": "tls",
        "host": "relay.dig.net",
        "port": 443
      },
      "excludeFromOverall": true
    },
    {
      "id": "coinset",
      "name": "coinset.org ChainView",
      "category": "Chia",
      "status": "up",
      "latencyMs": 639,
      "checkedAt": "2026-10-20T02:58:10.094Z",
      "description": "Chia mainnet RPC (blockchain state / peak height) — the chain trust root.",
      "url": "https://api.coinset.org/get_blockchain_state",
      "detail": {
        "kind": "chainview",
        "peakHeight": 9455789,
        "synced": true
      },
      "peakHeight": 9455789
    },
    {
      "id": "chia-mainnet",
      "name": "Chia mainnet",
      "category": "Chia",
      "status": "up",
      "latencyMs": 0,
      "checkedAt": "2026-10-20T02:58:10.095Z",
      "description": "Mainnet liveness — derived from coinset peak-height freshness.",
      "detail": {
        "kind": "derived",
        "peakHeight": 9455789,
        "advancedBy": 43,
        "secondsSincePrev": 602
      }
    }
  ]
}
